Company Name,Street Address 1,Street Address 2,City,State,Zip Code,Country,Industries,Team Member 1,Team Member 2,Team Member 3,Team Member 4,Team Member 5
"Point 41 Capital Partners, L.P.",One River Road,,Greenwich,CT,6807,US,"Third Party Logistics (3PL), Aerospace & Defense, Building Products, Construction & Engineering, Electrical Components & Equipment, Heavy Electrical Equipment, Industrial Conglomerates, Third Party Logistics (3PL), Food Distributors, Trading Companies & Distributors, Technology Distributors, Air Freight & Logistics, Marine Shipping, Trucking, Health Care Distributors, Retail Distributors, Construction & Farm Machinery & Heavy Trucks, Industrial Machinery & Equipment, Trading Companies & Distributors, Safety Equipment, Data Processing & Outsourced Services, Advertising, Payment Processors, Environmental & Facilities Services, Office Services & Supplies, Diversified Support Services, Security & Alarm Services, Human Resource & Employment Services, Research & Consulting Services, Airport Services, Marine Ports & Services, Commercial Printing, IT Consulting & Other Services, Air Freight & Logistics, Airlines, Marine Shipping, Railroads, Trucking, Airport Services, Highways & Railtracks, Marine Ports & Services, Automobile Manufacturers, Motorcycle Manufacturers, Aerospace & Defense, Building Products, Heavy Electrical Equipment, Construction & Farm Machinery & Heavy Trucks, Industrial Machinery & Equipment, Electronic Manufacturing Services, Construction Materials, Health Care Equipment, Consumer Electronics, Computer Storage & Peripherals, Photographic Products, Apparel, Accessories & Luxury Goods, Textiles, Personal Products, Office Electronics, Auto Parts & Accessories, Paper Packaging, Health Care Supplies, Paper Products, Metal, Glass & Plastic Containers, Safety Equipment, Forest Products, Tires & Rubber",Michael Berry,,,,
Occom Ventures,717 Manhattan Ave,,Brooklyn ,NY,11222,US,"Technology Distributors, Semiconductor Equipment , Semiconductors, Data Processing & Outsourced Services, Advertising, Payment Processors, Environmental & Facilities Services, Office Services & Supplies, Diversified Support Services, Security & Alarm Services, Human Resource & Employment Services, Research & Consulting Services, Airport Services, Marine Ports & Services, Commercial Printing, IT Consulting & Other Services, Communications Equipment, Application Software, Systems Software, Home Entertainment Software, Financial Technology, Health Care Technology, Internet Software & Services, Electrical Components & Equipment, Computer Hardware, Computer Storage & Peripherals, Electronic Equipment & Instruments , Electronic Components, Electronic Manufacturing Services",Bo Gibson,Vikram Bodas,Ian Whitney,,
Sam & Megna Test Capital,443 Park Avenue South,,New York,NY,10016,US,Advertising,Stanley Wilson,,,,
InterAlpen Partners,13030 Pierce St,,Omaha,NE,68144,US,"Advertising, Payment Processors, Environmental & Facilities Services, Office Services & Supplies, Diversified Support Services, Security & Alarm Services, Human Resource & Employment Services, Research & Consulting Services, Airport Services, Marine Ports & Services, Commercial Printing, IT Consulting & Other Services, Financial Technology, Health Care Equipment, Health Care Supplies, Health Care Distributors, Health Care Services, Health Care Facilities, Managed Health Care, Health Care Technology, Diversified Banks, Regional Banks, Thrifts & S&Ls, Communications Equipment, Other Diversified Financial Services, Multi-Sector Holdings, Specialized Finance, Asset Management & Custody Banks, Investment Banking & Brokerage, Diversified Capital Markets, Credit & Debit Card Issuers, Mortgage Banker, Mortgage Broker, Mortgage Processors & Servicers, Payday Lenders, Payment Processors, Insurance Brokers, Life & Health Insurance, Multi-line Insurance, Property & Casualty Insurance, Reinsurance, Application Software, Systems Software, Home Entertainment Software, Financial Technology, Health Care Technology, Internet Software & Services, Electrical Components & Equipment, Computer Hardware, Computer Storage & Peripherals, Electronic Equipment & Instruments , Electronic Components, Electronic Manufacturing Services, Technology Distributors, Semiconductor Equipment , Semiconductors, Data Processing & Outsourced Services",Mark Stafford,,,,
Waverider Partners,4468 Christensen Cir,,Littleton,CO,80123,US,"Third Party Logistics (3PL), Aerospace & Defense, Building Products, Construction & Engineering, Electrical Components & Equipment, Heavy Electrical Equipment, Industrial Conglomerates, Construction & Farm Machinery & Heavy Trucks, Industrial Machinery & Equipment, Trading Companies & Distributors, Safety Equipment, Data Processing & Outsourced Services, Advertising, Payment Processors, Environmental & Facilities Services, Office Services & Supplies, Diversified Support Services, Security & Alarm Services, Human Resource & Employment Services, Research & Consulting Services, Airport Services, Marine Ports & Services, Commercial Printing, IT Consulting & Other Services, Air Freight & Logistics, Airlines, Marine Shipping, Railroads, Trucking, Airport Services, Highways & Railtracks, Marine Ports & Services, Automobile Manufacturers, Health Care Equipment, Health Care Supplies, Health Care Distributors, Health Care Services, Health Care Facilities, Managed Health Care, Health Care Technology, Motorcycle Manufacturers, Aerospace & Defense, Building Products, Heavy Electrical Equipment, Construction & Farm Machinery & Heavy Trucks, Industrial Machinery & Equipment, Electronic Manufacturing Services, Construction Materials, Health Care Equipment, Consumer Electronics, Computer Storage & Peripherals, Photographic Products, Apparel, Accessories & Luxury Goods, Textiles, Personal Products, Office Electronics, Auto Parts & Accessories, Paper Packaging, Health Care Supplies, Paper Products, Metal, Glass & Plastic Containers, Safety Equipment, Forest Products, Tires & Rubber",Wes Schrader,,,,
Agellus Capital,"7733 Forsyth Boulevard, Suite 1100",,Clayton,MO,63105,US,"Technology Distributors, Air Freight & Logistics, Marine Shipping, Trucking, Data Processing & Outsourced Services, Payment Processors, Environmental & Facilities Services, Office Services & Supplies, Diversified Support Services, Security & Alarm Services, Human Resource & Employment Services, Research & Consulting Services, Airport Services, Marine Ports & Services, Third Party Logistics (3PL), IT Consulting & Other Services, Air Freight & Logistics, Airlines, Marine Shipping, Railroads, Trucking, Airport Services, Highways & Railtracks, Marine Ports & Services, Education Services, Specialized Consumer Services, Third Party Logistics (3PL), Food Distributors, Trading Companies & Distributors",Justin Smith,,,,
Mustang Entrepreneurs,4412 Stanford Ave,,Dallas,TX,75225,US,"Aerospace & Defense, Building Products, Construction & Engineering, Electrical Components & Equipment, Heavy Electrical Equipment, Industrial Conglomerates, Construction & Farm Machinery & Heavy Trucks, Industrial Machinery & Equipment, Trading Companies & Distributors, Safety Equipment, Third Party Logistics (3PL), Air Freight & Logistics, Airlines, Marine Shipping, Railroads, Trucking, Airport Services, Highways & Railtracks, Marine Ports & Services",Suresh Narayanan,,,,
Worklyn Partners,"275 Canal Street , Floor 5",4651 Salisbury Rd,New York,NY,10013,US,"Communications Equipment, Third Party Logistics (3PL), Air Freight & Logistics, Airlines, Marine Shipping, Railroads, Trucking, Airport Services, Highways & Railtracks, Marine Ports & Services, Alternative Carriers, Integrated Telecommunication Services, Wireless Telecommunication Services, Safety Equipment, Electrical Components & Equipment, Computer Hardware, Computer Storage & Peripherals, Electronic Equipment & Instruments , Electronic Components, Electronic Manufacturing Services, Technology Distributors, Semiconductor Equipment , Semiconductors, Application Software, Systems Software, Home Entertainment Software, Financial Technology, Health Care Technology, Internet Software & Services, Aerospace & Defense, Building Products, Construction & Engineering, Electrical Components & Equipment, Heavy Electrical Equipment, Industrial Conglomerates, Construction & Farm Machinery & Heavy Trucks, Industrial Machinery & Equipment, Trading Companies & Distributors",Aryan Lalwani,Johnny Lieberman,Hannah Paige,Zachary Miller,Ryan Webb
Kingswood Capital Management LP,11812 San Vicente Blvd #604,,Los Angeles,CA,90049,US,"Third Party Logistics (3PL), Food Distributors, Trading Companies & Distributors, Technology Distributors, Air Freight & Logistics, Marine Shipping, Trucking, Health Care Distributors, Retail Distributors, Data Processing & Outsourced Services, Advertising, Payment Processors, Environmental & Facilities Services, Office Services & Supplies, Diversified Support Services, Security & Alarm Services, Human Resource & Employment Services, Research & Consulting Services, Airport Services, Marine Ports & Services, Commercial Printing, IT Consulting & Other Services, Casino & Gaming Operators, Hotel, Resort & Cruise Line Operators, Leisure Facilities, Restaurants, Education Services, Specialized Consumer Services, Health Care Equipment, Health Care Supplies, Health Care Distributors, Health Care Services, Health Care Facilities, Managed Health Care, Health Care Technology, Apparel Retail, Computer & Electronics Retail, Home Improvement Retail, Specialty Stores, Automotive Retail, Homefurnishing Retail, Drug Retail, Food Retail, Hypermarkets & Super Centers, Retail Distributors, Catalog Retail, Internet Retail, Department Stores, General Merchandise Stores, Application Software, Systems Software, Home Entertainment Software, Financial Technology, Health Care Technology, Internet Software & Services, Aerospace & Defense, Building Products, Construction & Engineering, Electrical Components & Equipment, Heavy Electrical Equipment, Industrial Conglomerates, Construction & Farm Machinery & Heavy Trucks, Industrial Machinery & Equipment, Trading Companies & Distributors, Safety Equipment, Electrical Components & Equipment, Computer Hardware, Computer Storage & Peripherals, Electronic Equipment & Instruments , Electronic Components, Electronic Manufacturing Services, Technology Distributors, Semiconductor Equipment , Semiconductors, Communications Equipment, Third Party Logistics (3PL), Air Freight & Logistics, Airlines, Marine Shipping, Railroads, Trucking, Airport Services, Highways & Railtracks, Marine Ports & Services, Auto Parts & Accessories, Tires & Rubber, Consumer Electronics, Home Furnishings, Homebuilding, Household Appliances, Housewares & Specialties, Leisure Products, Photographic Products, Apparel, Accessories & Luxury Goods, Footwear, Textiles, Automobile Manufacturers, Motorcycle Manufacturers, Aerospace & Defense, Building Products, Heavy Electrical Equipment, Construction & Farm Machinery & Heavy Trucks, Industrial Machinery & Equipment, Electronic Manufacturing Services, Construction Materials, Health Care Equipment, Consumer Electronics, Computer Storage & Peripherals, Photographic Products, Apparel, Accessories & Luxury Goods, Textiles, Personal Products, Office Electronics, Auto Parts & Accessories, Paper Packaging, Health Care Supplies, Paper Products, Metal, Glass & Plastic Containers, Safety Equipment, Forest Products, Tires & Rubber, Brewers, Distillers & Vintners, Soft Drinks, Agricultural Products, Packaged Foods & Meats, Tobacco, Household Products, Personal Products",Chris Basham,Clay Lechleiter,Andrew Kovach,Michael Niegsch,
Sandkey Capital,"1 Grove Street, #323","40 Grove Street, Suite 450",Wellesley,MA,2482,US,"Aerospace & Defense, Building Products, Construction & Engineering, Electrical Components & Equipment, Heavy Electrical Equipment, Industrial Conglomerates, Construction & Farm Machinery & Heavy Trucks, Industrial Machinery & Equipment, Trading Companies & Distributors, Safety Equipment, Third Party Logistics (3PL), Air Freight & Logistics, Airlines, Marine Shipping, Railroads, Trucking, Airport Services, Highways & Railtracks, Marine Ports & Services, Application Software, Systems Software, Home Entertainment Software, Financial Technology, Health Care Technology, Internet Software & Services, Data Processing & Outsourced Services, Advertising, Payment Processors, Environmental & Facilities Services, Office Services & Supplies, Diversified Support Services, Security & Alarm Services, Human Resource & Employment Services, Research & Consulting Services, Airport Services, Marine Ports & Services, Commercial Printing, IT Consulting & Other Services, Health Care Equipment, Health Care Supplies, Health Care Distributors, Health Care Services, Health Care Facilities, Managed Health Care, Health Care Technology, Apparel Retail, Computer & Electronics Retail, Home Improvement Retail, Specialty Stores, Automotive Retail, Homefurnishing Retail, Drug Retail, Food Retail, Hypermarkets & Super Centers, Retail Distributors, Catalog Retail, Internet Retail, Department Stores, General Merchandise Stores, Consumer Electronics, Home Furnishings, Homebuilding, Household Appliances, Housewares & Specialties, Leisure Products, Photographic Products, Apparel, Accessories & Luxury Goods, Footwear, Textiles, Household Products, Personal Products, Brewers, Distillers & Vintners, Soft Drinks, Agricultural Products, Packaged Foods & Meats, Tobacco, Auto Parts & Accessories, Tires & Rubber",Kevin Smith,,,,
Zenith IOS LLC,45 Main St # 506,,Brooklyn,NY,11201,US,"Third Party Logistics (3PL), Food Distributors, Trading Companies & Distributors, Technology Distributors, Air Freight & Logistics, Marine Shipping, Trucking, Health Care Distributors, Retail Distributors, Data Processing & Outsourced Services, Advertising, Payment Processors, Environmental & Facilities Services, Office Services & Supplies, Diversified Support Services, Security & Alarm Services, Human Resource & Employment Services, Research & Consulting Services, Airport Services, Marine Ports & Services, Commercial Printing, IT Consulting & Other Services, Health Care Equipment, Health Care Supplies, Health Care Distributors, Health Care Services, Health Care Facilities, Managed Health Care, Health Care Technology, Aerospace & Defense, Building Products, Construction & Engineering, Electrical Components & Equipment, Heavy Electrical Equipment, Industrial Conglomerates, Construction & Farm Machinery & Heavy Trucks, Industrial Machinery & Equipment, Trading Companies & Distributors, Safety Equipment, Third Party Logistics (3PL), Air Freight & Logistics, Airlines, Marine Shipping, Railroads, Trucking, Airport Services, Highways & Railtracks, Marine Ports & Services, Auto Parts & Accessories, Tires & Rubber, Consumer Electronics, Home Furnishings, Homebuilding, Household Appliances, Housewares & Specialties, Leisure Products, Photographic Products, Apparel, Accessories & Luxury Goods, Footwear, Textiles, Automobile Manufacturers, Motorcycle Manufacturers, Aerospace & Defense, Building Products, Heavy Electrical Equipment, Construction & Farm Machinery & Heavy Trucks, Industrial Machinery & Equipment, Electronic Manufacturing Services, Construction Materials, Health Care Equipment, Consumer Electronics, Computer Storage & Peripherals, Photographic Products, Apparel, Accessories & Luxury Goods, Textiles, Personal Products, Office Electronics, Auto Parts & Accessories, Paper Packaging, Health Care Supplies, Paper Products, Metal, Glass & Plastic Containers, Safety Equipment, Forest Products, Tires & Rubber, Brewers, Distillers & Vintners, Soft Drinks, Agricultural Products, Packaged Foods & Meats, Tobacco, Household Products, Personal Products",Stephen Barry,Eitan Gerszberg,Vinh Thai,,
StrandPoint,9800 Wilshire Blvd.,,Beverly Hills,CA,90212,US,"Food Distributors, Highways & Railtracks, Data Processing & Outsourced Services, Environmental & Facilities Services, Diversified Support Services, Human Resource & Employment Services, Airport Services, Marine Ports & Services, Marine Ports & Services, Airport Services",Jeff McNerney,Andy Segal,,,
Vineyard Infrastructure,"180 Central Park S, 155",,New York,NY,10019,US,"Aerospace & Defense, Diversified Real Estate Activities, Construction & Engineering, Real Estate Development, Real Estate Services, Third Party Logistics (3PL), Air Freight & Logistics, Marine Shipping, Trucking, Environmental & Facilities Services, Third Party Logistics (3PL), Air Freight & Logistics, Marine Shipping, Railroads, Trucking, Airport Services, Marine Ports & Services, Airport Services, IT Consulting & Other Services, Highways & Railtracks, Marine Ports & Services, Water Utilities, Electric Utilities, Alternative Energy Production, Alternative Energy Distribution, Integrated Telecommunication Services, Wireless Telecommunication Services, Cable & Satellite, Health Care Services, Health Care Facilities",Felipe Cifuentes,Casey Bush,Andrew Aran,,
Sam Fredy Megna Capital Test,443 Park Avenue South,,New York,NY,10016,US,Broadcasting,Fredy Testing,,,,
Antarctica Capital,"200 Park Avenue, 32nd Floor",,New York,NY,10166,US,"Third Party Logistics (3PL), Application Software, Systems Software, Home Entertainment Software, Financial Technology, Health Care Technology, Internet Software & Services, Aerospace & Defense, Building Products, Construction & Engineering, Electrical Components & Equipment, Heavy Electrical Equipment, Industrial Conglomerates, Construction & Farm Machinery & Heavy Trucks, Industrial Machinery & Equipment, Trading Companies & Distributors, Safety Equipment, Electrical Components & Equipment, Computer Hardware, Computer Storage & Peripherals, Electronic Equipment & Instruments , Electronic Components, Electronic Manufacturing Services, Technology Distributors, Semiconductor Equipment , Semiconductors, Data Processing & Outsourced Services, Advertising, Payment Processors, Environmental & Facilities Services, Office Services & Supplies, Diversified Support Services, Security & Alarm Services, Human Resource & Employment Services, Research & Consulting Services, Airport Services, Marine Ports & Services, Commercial Printing, IT Consulting & Other Services, Air Freight & Logistics, Airlines, Marine Shipping, Railroads, Trucking, Airport Services, Highways & Railtracks, Marine Ports & Services, Health Care Equipment, Health Care Supplies, Health Care Distributors, Health Care Services, Health Care Facilities, Managed Health Care, Health Care Technology, Communications Equipment",Timothy Ng,,,,
Granite Instruments,117 Kendrick St Suite 300,,Needham,MA,2494,US,"Application Software, Systems Software, Home Entertainment Software, Financial Technology, Health Care Technology, Internet Software & Services, Aerospace & Defense, Building Products, Construction & Engineering, Electrical Components & Equipment, Heavy Electrical Equipment, Industrial Conglomerates, Construction & Farm Machinery & Heavy Trucks, Industrial Machinery & Equipment, Trading Companies & Distributors, Safety Equipment, Electrical Components & Equipment, Computer Hardware, Computer Storage & Peripherals, Electronic Equipment & Instruments , Electronic Components, Electronic Manufacturing Services, Technology Distributors, Semiconductor Equipment , Semiconductors, Communications Equipment, Third Party Logistics (3PL), Air Freight & Logistics, Airlines, Marine Shipping, Railroads, Trucking, Airport Services, Highways & Railtracks, Marine Ports & Services, Automobile Manufacturers, Motorcycle Manufacturers, Aerospace & Defense, Building Products, Heavy Electrical Equipment, Construction & Farm Machinery & Heavy Trucks, Industrial Machinery & Equipment, Electronic Manufacturing Services, Construction Materials, Health Care Equipment, Consumer Electronics, Computer Storage & Peripherals, Photographic Products, Apparel, Accessories & Luxury Goods, Textiles, Personal Products, Office Electronics, Auto Parts & Accessories, Paper Packaging, Health Care Supplies, Paper Products, Metal, Glass & Plastic Containers, Safety Equipment, Forest Products, Tires & Rubber",Doug Walsh,,,,
Montera,515 Madison Ave 8th fl,,New York,NY,10022,US,"Third Party Logistics (3PL), Food Distributors, Trading Companies & Distributors, Technology Distributors, Air Freight & Logistics, Marine Shipping, Trucking, Health Care Distributors, Retail Distributors, Data Processing & Outsourced Services, Advertising, Payment Processors, Environmental & Facilities Services, Office Services & Supplies, Diversified Support Services, Security & Alarm Services, Human Resource & Employment Services, Research & Consulting Services, Airport Services, Marine Ports & Services, Commercial Printing, IT Consulting & Other Services, Casino & Gaming Operators, Hotel, Resort & Cruise Line Operators, Leisure Facilities, Restaurants, Education Services, Specialized Consumer Services, Apparel Retail, Computer & Electronics Retail, Home Improvement Retail, Specialty Stores, Automotive Retail, Homefurnishing Retail, Drug Retail, Food Retail, Hypermarkets & Super Centers, Retail Distributors, Catalog Retail, Internet Retail, Department Stores, General Merchandise Stores, Application Software, Systems Software, Home Entertainment Software, Financial Technology, Health Care Technology, Internet Software & Services, Aerospace & Defense, Building Products, Construction & Engineering, Electrical Components & Equipment, Heavy Electrical Equipment, Industrial Conglomerates, Construction & Farm Machinery & Heavy Trucks, Industrial Machinery & Equipment, Trading Companies & Distributors, Safety Equipment, Electrical Components & Equipment, Computer Hardware, Computer Storage & Peripherals, Electronic Equipment & Instruments , Electronic Components, Electronic Manufacturing Services, Technology Distributors, Semiconductor Equipment , Semiconductors, Communications Equipment, Third Party Logistics (3PL), Air Freight & Logistics, Airlines, Marine Shipping, Railroads, Trucking, Airport Services, Highways & Railtracks, Marine Ports & Services, Auto Parts & Accessories, Tires & Rubber, Consumer Electronics, Home Furnishings, Homebuilding, Household Appliances, Housewares & Specialties, Leisure Products, Photographic Products, Apparel, Accessories & Luxury Goods, Footwear, Textiles, Automobile Manufacturers, Motorcycle Manufacturers, Aerospace & Defense, Building Products, Heavy Electrical Equipment, Construction & Farm Machinery & Heavy Trucks, Industrial Machinery & Equipment, Electronic Manufacturing Services, Construction Materials, Health Care Equipment, Consumer Electronics, Computer Storage & Peripherals, Photographic Products, Apparel, Accessories & Luxury Goods, Textiles, Personal Products, Office Electronics, Auto Parts & Accessories, Paper Packaging, Health Care Supplies, Paper Products, Metal, Glass & Plastic Containers, Safety Equipment, Forest Products, Tires & Rubber, Brewers, Distillers & Vintners, Soft Drinks, Agricultural Products, Packaged Foods & Meats, Tobacco, Household Products, Personal Products",Kareem Mahmoud,,,,
mtn. GOAT CAPITAL mgmt.,"848 N Rainbow Blvd, 9012",,Las Vegas,NV,89107,US,"Building Products, Third Party Logistics (3PL), Airport Services, Third Party Logistics (3PL), Food Distributors, Trading Companies & Distributors, Trucking, Health Care Distributors, Computer Storage & Peripherals, Photographic Products, Apparel, Accessories & Luxury Goods, Textiles, Personal Products, Paper Packaging, Health Care Supplies, Paper Products, Metal, Glass & Plastic Containers, Safety Equipment, Forest Products, Data Processing & Outsourced Services, Environmental & Facilities Services, Office Services & Supplies, Diversified Support Services, Security & Alarm Services, Airport Services, Metal, Glass & Plastic Containers, Paper Packaging, Specialty Chemicals, Education Services, Health Care Equipment, Health Care Distributors, Health Care Services",Joe Shofner,,,,
Forest Road Company,"1177 Avenue of the Americas, 5th Floor #101","1177 Avenue of the Americas, 5th Floor #101",New York,NY,10036,US,"Aerospace & Defense, Building Products, Construction & Engineering, Electrical Components & Equipment, Heavy Electrical Equipment, Industrial Conglomerates, Construction & Farm Machinery & Heavy Trucks, Industrial Machinery & Equipment, Trading Companies & Distributors, Safety Equipment, Third Party Logistics (3PL), Air Freight & Logistics, Airlines, Marine Shipping, Railroads, Trucking, Airport Services, Highways & Railtracks, Marine Ports & Services, Auto Parts & Accessories, Tires & Rubber, Consumer Electronics, Home Furnishings, Homebuilding, Household Appliances, Housewares & Specialties, Leisure Products, Photographic Products, Apparel, Accessories & Luxury Goods, Footwear, Textiles, Apparel Retail, Computer & Electronics Retail, Home Improvement Retail, Specialty Stores, Automotive Retail, Homefurnishing Retail, Drug Retail, Food Retail, Hypermarkets & Super Centers, Retail Distributors, Catalog Retail, Internet Retail, Department Stores, General Merchandise Stores, Brewers, Distillers & Vintners, Soft Drinks, Agricultural Products, Packaged Foods & Meats, Tobacco, Household Products, Personal Products",Jeremy Tarica,Idan Shani,Emily Reed,Anthony Huang,
