Company Name,Street Address 1,Street Address 2,City,State,Zip Code,Country,Industries,Team Member 1,Team Member 2,Team Member 3,Team Member 4,Team Member 5
Optimus Capital Partners,W172 N7844 Shady Lane,,Menomonee Falls,WI,53051,US,"Data Processing & Outsourced Services, Advertising, Payment Processors, Environmental & Facilities Services, Office Services & Supplies, Diversified Support Services, Security & Alarm Services, Human Resource & Employment Services, Research & Consulting Services, Airport Services, Marine Ports & Services, Commercial Printing, IT Consulting & Other Services, Health Care Equipment, Health Care Supplies, Health Care Distributors, Health Care Services, Health Care Facilities, Managed Health Care, Health Care Technology, Application Software, Systems Software, Home Entertainment Software, Financial Technology, Health Care Technology, Internet Software & Services, Aerospace & Defense, Building Products, Construction & Engineering, Electrical Components & Equipment, Heavy Electrical Equipment, Industrial Conglomerates, Construction & Farm Machinery & Heavy Trucks, Industrial Machinery & Equipment, Trading Companies & Distributors, Safety Equipment, Electrical Components & Equipment, Computer Hardware, Computer Storage & Peripherals, Electronic Equipment & Instruments , Electronic Components, Electronic Manufacturing Services, Technology Distributors, Semiconductor Equipment , Semiconductors, Communications Equipment, Third Party Logistics (3PL), Air Freight & Logistics, Airlines, Marine Shipping, Railroads, Trucking, Airport Services, Highways & Railtracks, Marine Ports & Services, Auto Parts & Accessories, Tires & Rubber, Consumer Electronics, Home Furnishings, Homebuilding, Household Appliances, Housewares & Specialties, Leisure Products, Photographic Products, Apparel, Accessories & Luxury Goods, Footwear, Textiles, Automobile Manufacturers, Motorcycle Manufacturers, Aerospace & Defense, Building Products, Heavy Electrical Equipment, Construction & Farm Machinery & Heavy Trucks, Industrial Machinery & Equipment, Electronic Manufacturing Services, Construction Materials, Health Care Equipment, Consumer Electronics, Computer Storage & Peripherals, Photographic Products, Apparel, Accessories & Luxury Goods, Textiles, Personal Products, Office Electronics, Auto Parts & Accessories, Paper Packaging, Health Care Supplies, Paper Products, Metal, Glass & Plastic Containers, Safety Equipment, Forest Products, Tires & Rubber, Brewers, Distillers & Vintners, Soft Drinks, Agricultural Products, Packaged Foods & Meats, Tobacco, Household Products, Personal Products",Kevin Seiberlich,,,,
Growealth Ventures,951 W Main Street,,Mesa,AZ,85201,US,"Third Party Logistics (3PL), Food Distributors, Trading Companies & Distributors, Technology Distributors, Air Freight & Logistics, Marine Shipping, Trucking, Health Care Distributors, Retail Distributors, Data Processing & Outsourced Services, Advertising, Payment Processors, Environmental & Facilities Services, Office Services & Supplies, Diversified Support Services, Security & Alarm Services, Human Resource & Employment Services, Research & Consulting Services, Airport Services, Marine Ports & Services, Commercial Printing, IT Consulting & Other Services, Apparel Retail, Computer & Electronics Retail, Home Improvement Retail, Specialty Stores, Automotive Retail, Homefurnishing Retail, Drug Retail, Food Retail, Hypermarkets & Super Centers, Retail Distributors, Catalog Retail, Internet Retail, Department Stores, General Merchandise Stores, Application Software, Systems Software, Home Entertainment Software, Financial Technology, Health Care Technology, Internet Software & Services, Electrical Components & Equipment, Computer Hardware, Computer Storage & Peripherals, Electronic Equipment & Instruments , Electronic Components, Electronic Manufacturing Services, Technology Distributors, Semiconductor Equipment , Semiconductors, Communications Equipment, Automobile Manufacturers, Motorcycle Manufacturers, Aerospace & Defense, Building Products, Heavy Electrical Equipment, Construction & Farm Machinery & Heavy Trucks, Industrial Machinery & Equipment, Electronic Manufacturing Services, Construction Materials, Health Care Equipment, Consumer Electronics, Computer Storage & Peripherals, Photographic Products, Apparel, Accessories & Luxury Goods, Textiles, Personal Products, Office Electronics, Auto Parts & Accessories, Paper Packaging, Health Care Supplies, Paper Products, Metal, Glass & Plastic Containers, Safety Equipment, Forest Products, Tires & Rubber",Shan Patel,,,,
Burdette Asset Management,8964 Little Mountain  Suite 1000,,Kirtland Hills,OH,44060,US,,Walter Deeter,,,,
Red Tractor Energy,"3710 Exchange Glenwood Place, Apt., 408","3710 Exchange Glenwood Place, Apt., 408",Raleigh,NC,27612,US,"Data Processing & Outsourced Services, Advertising, Payment Processors, Environmental & Facilities Services, Office Services & Supplies, Diversified Support Services, Security & Alarm Services, Human Resource & Employment Services, Research & Consulting Services, Airport Services, Marine Ports & Services, Commercial Printing, IT Consulting & Other Services",Charles Davis,Craig Stafford,Carolyn Grant,,
"Author Capital Partners, LLC","230 W SUPERIOR ST, STE 200",,CHICAGO,IL,60654-3581,US,"Third Party Logistics (3PL), Application Software, Systems Software, Home Entertainment Software, Financial Technology, Health Care Technology, Internet Software & Services, Aerospace & Defense, Building Products, Construction & Engineering, Electrical Components & Equipment, Heavy Electrical Equipment, Industrial Conglomerates, Construction & Farm Machinery & Heavy Trucks, Industrial Machinery & Equipment, Trading Companies & Distributors, Safety Equipment, Electrical Components & Equipment, Computer Hardware, Computer Storage & Peripherals, Electronic Equipment & Instruments , Electronic Components, Electronic Manufacturing Services, Technology Distributors, Semiconductor Equipment , Semiconductors, Data Processing & Outsourced Services, Advertising, Payment Processors, Environmental & Facilities Services, Office Services & Supplies, Diversified Support Services, Security & Alarm Services, Human Resource & Employment Services, Research & Consulting Services, Airport Services, Marine Ports & Services, Commercial Printing, IT Consulting & Other Services, Air Freight & Logistics, Airlines, Marine Shipping, Railroads, Trucking, Airport Services, Highways & Railtracks, Marine Ports & Services, Communications Equipment",Nicholas Brand,Tetiana Sharova,Duane Jackson,Andrew Hausmann,Milton Parra
"River Capital, Inc.","4200 Northside Parkway, Building 14 suite 250",,Atlanta,GA,30327,US,"Specialized Finance, Investment Banking & Brokerage, Diversified Capital Markets, Thrifts & S&Ls",Bryan Wethington,,,,
"Hunt Equity, LLC",2488 River Reach Drive,,New York,NY,34104,US,"Financial Technology, Health Care Technology, Payment Processors, Fertilizers & Agricultural Chemicals, Health Care Equipment, Health Care Technology, Brewers, Distillers & Vintners, Agricultural Products, Tobacco",Christopher Hunt,,,,
Arcspring LLC,"Terminus 100, 3280 Peachtree Road",,Atlanta,GA,30305,US,"Third Party Logistics (3PL), Aerospace & Defense, Building Products, Construction & Engineering, Electrical Components & Equipment, Heavy Electrical Equipment, Industrial Conglomerates, Third Party Logistics (3PL), Food Distributors, Trading Companies & Distributors, Technology Distributors, Air Freight & Logistics, Marine Shipping, Trucking, Health Care Distributors, Retail Distributors, Construction & Farm Machinery & Heavy Trucks, Industrial Machinery & Equipment, Trading Companies & Distributors, Safety Equipment, Data Processing & Outsourced Services, Advertising, Payment Processors, Environmental & Facilities Services, Office Services & Supplies, Diversified Support Services, Security & Alarm Services, Human Resource & Employment Services, Research & Consulting Services, Airport Services, Marine Ports & Services, Commercial Printing, IT Consulting & Other Services, Air Freight & Logistics, Airlines, Marine Shipping, Railroads, Trucking, Airport Services, Highways & Railtracks, Marine Ports & Services, Automobile Manufacturers, Health Care Equipment, Health Care Supplies, Health Care Distributors, Health Care Services, Health Care Facilities, Managed Health Care, Health Care Technology, Motorcycle Manufacturers, Aerospace & Defense, Building Products, Heavy Electrical Equipment, Construction & Farm Machinery & Heavy Trucks, Industrial Machinery & Equipment, Electronic Manufacturing Services, Construction Materials, Health Care Equipment, Consumer Electronics, Computer Storage & Peripherals, Photographic Products, Apparel, Accessories & Luxury Goods, Textiles, Personal Products, Office Electronics, Auto Parts & Accessories, Paper Packaging, Health Care Supplies, Paper Products, Metal, Glass & Plastic Containers, Safety Equipment, Forest Products, Tires & Rubber",Ziv Weizman,Lee Ward,Corey Tollefson,Duncan Angove,Simon Angove
Clean Energy Advisors,"810 Dominican Drive, Impact 2.5",,Nashville,TN,37228,US,"Alternative Energy Production, Alternative Energy Distribution",Scott Hill,,,,
Sumeru Equity Partners,"950 Tower Lane, 17th Floor",,Foster City,CA,94404,US,Application Software,Jason Babcoke,Nathan Stanley,Maddison Smith,,
PT Capital,"188 West Northern Lights Blvd., Suite 920",,Anchorage,AK,99503,US,,Dan Kobayashi,,,,
Mackinaw Management,444 West Lake Street Suite 1700,,Chicago,IL,60606,US,,Mark Hackman Brooks,James Fox,,,
"Veritas Commercial Finance, LLC","26400 Kuykendahl Rd, STE C180-512",,Spring ,TX,77375,US,"Third Party Logistics (3PL), Aerospace & Defense, Building Products, Construction & Engineering, Electrical Components & Equipment, Heavy Electrical Equipment, Industrial Conglomerates, Construction & Farm Machinery & Heavy Trucks, Industrial Machinery & Equipment, Trading Companies & Distributors, Safety Equipment, Data Processing & Outsourced Services, Advertising, Payment Processors, Environmental & Facilities Services, Office Services & Supplies, Diversified Support Services, Security & Alarm Services, Human Resource & Employment Services, Research & Consulting Services, Airport Services, Marine Ports & Services, Commercial Printing, IT Consulting & Other Services, Air Freight & Logistics, Airlines, Marine Shipping, Railroads, Trucking, Airport Services, Highways & Railtracks, Marine Ports & Services, Automobile Manufacturers, Motorcycle Manufacturers, Aerospace & Defense, Building Products, Heavy Electrical Equipment, Construction & Farm Machinery & Heavy Trucks, Industrial Machinery & Equipment, Electronic Manufacturing Services, Construction Materials, Health Care Equipment, Consumer Electronics, Computer Storage & Peripherals, Photographic Products, Apparel, Accessories & Luxury Goods, Textiles, Personal Products, Office Electronics, Auto Parts & Accessories, Paper Packaging, Health Care Supplies, Paper Products, Metal, Glass & Plastic Containers, Safety Equipment, Forest Products, Tires & Rubber",Casey Minshew,,,,
Global Endowment Management,"550 S. Tryon St., Suite 3500",,Charlotte,NC,28202,US,,Torrey Feimster,,,,
Cebron Group,9844 Research Dr.,,Irvine,CA,92688,US,"Application Software, Systems Software, Home Entertainment Software, Financial Technology, Health Care Technology, Internet Software & Services, Electrical Components & Equipment, Computer Hardware, Computer Storage & Peripherals, Electronic Equipment & Instruments , Electronic Components, Electronic Manufacturing Services, Technology Distributors, Semiconductor Equipment , Semiconductors, Communications Equipment, Health Care Equipment, Health Care Supplies, Health Care Distributors, Health Care Services, Health Care Facilities, Managed Health Care, Health Care Technology",Gary Bastien,Itzel Moncada,,,
Sundeck Capital Group,"9085 E Mineral Circle, Ste. 280",,Centennial,CO,80112,US,"Aerospace & Defense, Building Products, Construction & Engineering, Electrical Components & Equipment, Heavy Electrical Equipment, Industrial Conglomerates, Third Party Logistics (3PL), Food Distributors, Trading Companies & Distributors, Technology Distributors, Air Freight & Logistics, Construction & Farm Machinery & Heavy Trucks, Trucking, Health Care Distributors, Retail Distributors, Industrial Machinery & Equipment, Trading Companies & Distributors, Safety Equipment, Third Party Logistics (3PL), Air Freight & Logistics, Trucking, Airport Services, Highways & Railtracks, Specialized Consumer Services, Aerospace & Defense, Building Products, Heavy Electrical Equipment, Construction & Farm Machinery & Heavy Trucks, Industrial Machinery & Equipment, Electronic Manufacturing Services, Construction Materials, Health Care Equipment, Consumer Electronics, Computer Storage & Peripherals, Photographic Products, Apparel, Accessories & Luxury Goods, Textiles, Personal Products, Office Electronics, Auto Parts & Accessories, Paper Packaging, Health Care Supplies, Paper Products, Metal, Glass & Plastic Containers, Safety Equipment, Forest Products",Dave Lemmon,Patrick Meyer,James Tuttle,,
Oak Tree Commercial Realty,4666 Riley Lane,,Cincinnati,OH,45227,US,"Investment Banking & Brokerage, Diversified Real Estate Activities",Shawn Gilreath,,,,
CoVenture,600 Madison Avenue,,New York,NY,10022,US,"Electrical Components & Equipment, Computer Hardware, Computer Storage & Peripherals, Electronic Equipment & Instruments , Electronic Components, Electronic Manufacturing Services, Technology Distributors, Semiconductor Equipment , Semiconductors, Communications Equipment, Application Software, Systems Software, Home Entertainment Software, Financial Technology, Health Care Technology, Internet Software & Services",Josh Begleiter,Michael Breitstein,,,
Clark Investments LLC,51 Kendrick Pines Blvd.,,Spring,TX,77389,US,"Oil & Gas Storage & Transportation, Marine Shipping",Jake Chiasson,Clark Craft,,,
Kensington-SV Global,177 Huntington Ave,,Boston,MA,2115,US,"Internet Retail, Biotechnology, Pharmaceuticals, Life Sciences Tools & Services, Nutraceuticals, Financial Technology, Payment Processors, Health Care Technology, Application Software, Systems Software, Financial Technology, Health Care Technology, Internet Software & Services, Home Entertainment Software",Andrew Breger,Dane Nielsen,,,
Elm Equity Partners,"222 Broadway, 19th Floor",,New York,NY,10038,US,"Investment Banking & Brokerage, Other Diversified Financial Services",Andrew Kopalidis,,,,
Twist Capital,9800 Wilshire Boulevard,,Beverly Hills,CA,90212,US,,Michael Carter,,,,
DP2 Capital Group,640 West Putnam Avenue,,Grenwich,CT,6831,US,"Aerospace & Defense, Building Products, Construction & Engineering, Electrical Components & Equipment, Heavy Electrical Equipment, Industrial Conglomerates, Construction & Farm Machinery & Heavy Trucks, Industrial Machinery & Equipment, Trading Companies & Distributors, Safety Equipment, Third Party Logistics (3PL), Air Freight & Logistics, Trucking, Airport Services, Marine Ports & Services, Diversified Real Estate Activities, Real Estate Operating Companies, Real Estate Development, Real Estate Services, Third Party Logistics (3PL), Food Distributors, Trading Companies & Distributors, Health Care Distributors, Automobile Manufacturers, Motorcycle Manufacturers, Aerospace & Defense, Building Products, Heavy Electrical Equipment, Construction & Farm Machinery & Heavy Trucks, Industrial Machinery & Equipment, Electronic Manufacturing Services, Construction Materials, Health Care Equipment, Consumer Electronics, Computer Storage & Peripherals, Apparel, Accessories & Luxury Goods, Textiles, Personal Products, Office Electronics, Auto Parts & Accessories, Health Care Supplies, Metal, Glass & Plastic Containers, Safety Equipment, Forest Products, Tires & Rubber, Home Entertainment Software, Payment Processors, Environmental & Facilities Services, Office Services & Supplies, Diversified Support Services, Human Resource & Employment Services, Marine Ports & Services, IT Consulting & Other Services, Construction Materials, Hotel, Resort & Cruise Line Operators, Leisure Facilities, Specialized Consumer Services, Apparel Retail, Home Improvement Retail, Specialty Stores, Automotive Retail, Homefurnishing Retail, Drug Retail, Food Retail, Hypermarkets & Super Centers, Retail Distributors, Internet Retail, Department Stores, General Merchandise Stores, Home Furnishings, Homebuilding, Apparel, Accessories & Luxury Goods, Footwear, Textiles, Household Products, Personal Products, Brewers, Distillers & Vintners, Soft Drinks, Agricultural Products, Packaged Foods & Meats, Auto Parts & Accessories, Tires & Rubber, Pharmaceuticals, Nutraceuticals",Daniel Polizzi,,,,
Grand Sakwa Properties,28470 13 Mile Road,,Farmington Hills,MI,48334,US,,Jason Miller,,,,
"Alabama Equity Partners, LLC","121 Coosa Street, Suite 200",,Montgomery,AL,36104,US,,Dave Moore,,,,
Stripes Group,402 West 13th Street,,New York,NY,10014,US,"Soft Drinks, Footwear, Leisure Facilities, Household Appliances, Home Entertainment Software, Homebuilding, Housewares & Specialties, Internet Retail, Systems Software, Internet Software & Services, Textiles, Health Care Technology, Home Furnishings, Personal Products, Food Retail, Brewers, Application Software, Packaged Foods & Meats, Photographic Products, Publishing, Consumer Electronics, Restaurants, Apparel, Accessories & Luxury Goods, Distillers & Vintners, Leisure Products, Household Products, Apparel Retail, Financial Technology, Digital & Social Media, Computer & Electronics Retail, Home Improvement Retail",Matt Brown,,,,
Salt Creek Capital,"2055 Woodside Road, Suite 250",,Woodside,CA,94061,US,"Third Party Logistics (3PL), Trading Companies & Distributors, Trucking, Building Products, Data Processing & Outsourced Services, Specialized Consumer Services",Daniel Price,Daniel Phelps,Dan Mytels,Ricky Zhang,
Ouroboros Group,"100 Summer Street, Suite #1600",,Boston,MA,2110,US,"Aerospace & Defense, Building Products, Construction & Engineering, Electrical Components & Equipment, Heavy Electrical Equipment, Industrial Conglomerates, Construction & Farm Machinery & Heavy Trucks, Industrial Machinery & Equipment, Trading Companies & Distributors, Safety Equipment, Third Party Logistics (3PL), Air Freight & Logistics, Airlines, Marine Shipping, Railroads, Trucking, Airport Services, Highways & Railtracks, Marine Ports & Services, Third Party Logistics (3PL), Food Distributors, Trading Companies & Distributors, Technology Distributors, Air Freight & Logistics, Marine Shipping, Trucking, Health Care Distributors, Retail Distributors, Automobile Manufacturers, Motorcycle Manufacturers, Aerospace & Defense, Building Products, Heavy Electrical Equipment, Construction & Farm Machinery & Heavy Trucks, Industrial Machinery & Equipment, Electronic Manufacturing Services, Construction Materials, Health Care Equipment, Consumer Electronics, Computer Storage & Peripherals, Photographic Products, Apparel, Accessories & Luxury Goods, Textiles, Personal Products, Office Electronics, Auto Parts & Accessories, Paper Packaging, Health Care Supplies, Paper Products, Metal, Glass & Plastic Containers, Safety Equipment, Forest Products, Tires & Rubber, Data Processing & Outsourced Services, Advertising, Payment Processors, Environmental & Facilities Services, Office Services & Supplies, Diversified Support Services, Security & Alarm Services, Human Resource & Employment Services, Research & Consulting Services, Airport Services, Marine Ports & Services, Commercial Printing, IT Consulting & Other Services, Forest Products, Paper Products, Construction Materials, Metal, Glass & Plastic Containers, Paper Packaging, Fertilizers & Agricultural Chemicals, Industrial Gases, Specialty Chemicals, Commodity Chemicals, Diversified Chemicals, Nonmetallic Mineral Mining & Quarrying, Aluminum Products, Metal Ore Mining, Gold Products, Other Metal & Mineral Products, Steel Products, Casino & Gaming Operators, Hotel, Resort & Cruise Line Operators, Leisure Facilities, Restaurants, Education Services, Specialized Consumer Services, Health Care Equipment, Health Care Supplies, Health Care Distributors, Health Care Services, Health Care Facilities, Managed Health Care, Health Care Technology, Consumer Electronics, Home Furnishings, Homebuilding, Household Appliances, Housewares & Specialties, Leisure Products, Photographic Products, Apparel, Accessories & Luxury Goods, Footwear, Textiles, Household Products, Personal Products, Brewers, Distillers & Vintners, Soft Drinks, Agricultural Products, Packaged Foods & Meats, Tobacco, Auto Parts & Accessories, Tires & Rubber",Richard Tannenbaum,Vignesh Idya,Samantha Ory,,
Star Capital Management,"3363 NE 163rd St, Suite 707",,NMB,FL,33160,US,"Other Diversified Financial Services, Specialized Finance, Diversified Capital Markets, Mortgage Processors & Servicers",Dan Martinez,,,,
National Diversified Funding Corporation,1336 N Moorpark,,Thousand Oaks,CA,91360,US,,Anthony Kane [LION] Toplinked,,,,
Eiger Capital LLC,PO Box 185,,Winter Park,CO,80482,US,"Application Software, Financial Technology, Health Care Technology, Internet Software & Services, Real Estate Operating Companies, Real Estate Development, Data Processing & Outsourced Services, Environmental & Facilities Services, Diversified Support Services, Research & Consulting Services, Hotel, Resort & Cruise Line Operators, Leisure Facilities, Restaurants, Consumer Electronics, Specialized Consumer Services, Leisure Products, Apparel, Accessories & Luxury Goods, Apparel Retail, Specialty Stores, Food Retail, Distillers & Vintners, Personal Products",Ted Muftic,,,,
Burling Street Capital Partners,1850 N. Burling Street,,Chicago,IL,60614,US,"Aerospace & Defense, Building Products, Construction & Engineering, Third Party Logistics (3PL), Auto Parts & Accessories",Nick Coetzee,,,,
Cimarron Healthcare Capital,"50 Monument Road, Suite 201",6440 S. Wasatch Blvd Suite 380,Bala Cynwyd,PA,19004,US,"Health Care Equipment, Health Care Supplies, Health Care Distributors, Health Care Services, Health Care Facilities, Managed Health Care, Health Care Technology",Nick Smith,Daniel Brock,Michael Haller,William Pickard,
Pivotal Alpha,1558 Woodhaven Ln,,Wheaton,IL,60189,US,"Building Products, Heavy Electrical Equipment, Construction & Farm Machinery & Heavy Trucks, Industrial Machinery & Equipment, Electronic Manufacturing Services, Construction Materials, Health Care Equipment, Consumer Electronics, Computer Storage & Peripherals, Photographic Products, Apparel, Accessories & Luxury Goods, Textiles, Personal Products, Office Electronics, Auto Parts & Accessories, Paper Packaging, Health Care Supplies, Paper Products, Metal, Glass & Plastic Containers, Safety Equipment, Forest Products, Tires & Rubber, Brewers, Distillers & Vintners, Soft Drinks, Agricultural Products, Packaged Foods & Meats, Tobacco, Household Products, Personal Products, Third Party Logistics (3PL), Food Distributors, Trading Companies & Distributors, Technology Distributors, Air Freight & Logistics, Marine Shipping, Trucking, Health Care Distributors, Retail Distributors, Data Processing & Outsourced Services, Advertising, Payment Processors, Environmental & Facilities Services, Office Services & Supplies, Diversified Support Services, Security & Alarm Services, Human Resource & Employment Services, Research & Consulting Services, Airport Services, Marine Ports & Services, Commercial Printing, IT Consulting & Other Services, Casino & Gaming Operators, Hotel, Resort & Cruise Line Operators, Leisure Facilities, Restaurants, Education Services, Specialized Consumer Services, Health Care Equipment, Health Care Supplies, Health Care Distributors, Health Care Services, Health Care Facilities, Managed Health Care, Health Care Technology, Aerospace & Defense, Building Products, Construction & Engineering, Electrical Components & Equipment, Heavy Electrical Equipment, Industrial Conglomerates, Construction & Farm Machinery & Heavy Trucks, Industrial Machinery & Equipment, Trading Companies & Distributors, Safety Equipment, Third Party Logistics (3PL), Air Freight & Logistics, Airlines, Marine Shipping, Railroads, Trucking, Airport Services, Highways & Railtracks, Marine Ports & Services, Auto Parts & Accessories, Tires & Rubber, Consumer Electronics, Home Furnishings, Homebuilding, Household Appliances, Housewares & Specialties, Leisure Products, Photographic Products, Apparel, Accessories & Luxury Goods, Footwear, Textiles, Automobile Manufacturers, Motorcycle Manufacturers, Aerospace & Defense",Ruslan Sladkov,,,,
The EEI Fund,"430 Plasters Avenue N.E., Suite 100",,Atlanta,GA,30324,US,"Diversified Real Estate Activities, Real Estate Development, Food Retail",Jerry McGaughy,,,,
Reynolda Equity Partners,"101 N. Cherry Street, Suite 700",,Winston-Salem,NC,27101,US,"Financial Technology, Health Care Technology, Internet Software & Services, Third Party Logistics (3PL), Food Distributors, Technology Distributors, Air Freight & Logistics, Health Care Distributors, Data Processing & Outsourced Services, Environmental & Facilities Services, Diversified Support Services, Security & Alarm Services, Human Resource & Employment Services, Health Care Equipment, Health Care Distributors, Health Care Services, Health Care Technology, Auto Parts & Accessories, Health Care Supplies, Safety Equipment, Life Sciences Tools & Services, Application Software, Systems Software",Charlie Orr,Brent Kulman,,,
