Company Name,Street Address 1,Street Address 2,City,State,Zip Code,Country,Industries,Team Member 1,Team Member 2,Team Member 3,Team Member 4,Team Member 5
Banyan Capital Partners,"1400-130 King Street West, Suite 300",,Toronto,ON,M5X 1C8,CA,"Real Estate Services, Third Party Logistics (3PL), Food Distributors, Trading Companies & Distributors, Technology Distributors, Air Freight & Logistics, Marine Shipping, Trucking, Health Care Distributors, Retail Distributors, Data Processing & Outsourced Services, Advertising, Payment Processors, Environmental & Facilities Services, Office Services & Supplies, Diversified Support Services, Security & Alarm Services, Human Resource & Employment Services, Research & Consulting Services, Airport Services, Marine Ports & Services, Commercial Printing, IT Consulting & Other Services, Casino & Gaming Operators, Hotel, Resort & Cruise Line Operators, Leisure Facilities, Restaurants, Education Services, Specialized Consumer Services, Alternative Carriers, Integrated Telecommunication Services, Wireless Telecommunication Services, Broadcasting, Cable & Satellite, Movies & Entertainment, Health Care Equipment, Health Care Supplies, Health Care Distributors, Health Care Services, Health Care Facilities, Managed Health Care, Health Care Technology, Computer & Electronics Retail, Home Improvement Retail, Specialty Stores, Automotive Retail, Homefurnishing Retail, Drug Retail, Food Retail, Hypermarkets & Super Centers, Retail Distributors, Catalog Retail, Internet Retail, Department Stores, General Merchandise Stores, Pharmaceuticals, Life Sciences Tools & Services, Nutraceuticals, Credit & Debit Card Issuers, Mortgage Banker, Mortgage Broker, Mortgage Processors & Servicers, Payday Lenders, Payment Processors, Fertilizers & Agricultural Chemicals, Industrial Gases, Specialty Chemicals, Commodity Chemicals, Diversified Chemicals, Insurance Brokers, Life & Health Insurance, Multi-line Insurance, Property & Casualty Insurance, Reinsurance, Construction Materials, Metal, Glass & Plastic Containers, Paper Packaging, Health Care Technology, Aerospace & Defense, Building Products, Construction & Engineering, Electrical Components & Equipment, Heavy Electrical Equipment, Industrial Conglomerates, Construction & Farm Machinery & Heavy Trucks, Industrial Machinery & Equipment, Trading Companies & Distributors, Safety Equipment, Electrical Components & Equipment, Computer Hardware, Computer Storage & Peripherals, Electronic Equipment & Instruments , Electronic Components, Electronic Manufacturing Services, Technology Distributors, Semiconductor Equipment , Semiconductors, Communications Equipment, Forest Products, Paper Products, Third Party Logistics (3PL), Air Freight & Logistics, Airlines, Marine Shipping, Railroads, Trucking, Airport Services, Highways & Railtracks, Marine Ports & Services, Auto Parts & Accessories, Tires & Rubber, Consumer Electronics, Home Furnishings, Homebuilding, Household Appliances, Housewares & Specialties, Leisure Products, Photographic Products, Apparel, Accessories & Luxury Goods, Footwear, Textiles, Automobile Manufacturers, Motorcycle Manufacturers, Aerospace & Defense, Building Products, Heavy Electrical Equipment, Construction & Farm Machinery & Heavy Trucks, Industrial Machinery & Equipment, Electronic Manufacturing Services, Construction Materials, Health Care Equipment, Consumer Electronics, Computer Storage & Peripherals, Photographic Products, Apparel, Accessories & Luxury Goods, Textiles, Personal Products, Office Electronics, Auto Parts & Accessories, Paper Packaging, Health Care Supplies, Paper Products, Metal, Glass & Plastic Containers, Safety Equipment, Forest Products, Tires & Rubber, Brewers, Distillers & Vintners, Soft Drinks, Agricultural Products, Packaged Foods & Meats, Tobacco, Household Products, Personal Products",Mike Martin,Jeff Wigle,Adam Jezewski,Scott Morrison,Marat Altinbaev
Alaris Equity Partners,"Suite 250,  333 24th Avenue SW",,Calgary,AB,T2S 3E6,CA,"Metal Ore Mining, Gold Products, Other Metal & Mineral Products, Steel Products, Casino & Gaming Operators, Hotel, Resort & Cruise Line Operators, Leisure Facilities, Restaurants, Education Services, Specialized Consumer Services, Alternative Carriers, Integrated Telecommunication Services, Wireless Telecommunication Services, Digital & Social Media, Broadcasting, Cable & Satellite, Movies & Entertainment, Publishing, Advertising, Health Care Equipment, Health Care Supplies, Health Care Distributors, Health Care Services, Health Care Facilities, Managed Health Care, Health Care Technology, Apparel Retail, Computer & Electronics Retail, Home Improvement Retail, Specialty Stores, Automotive Retail, Homefurnishing Retail, Drug Retail, Food Retail, Hypermarkets & Super Centers, Retail Distributors, Catalog Retail, Internet Retail, Department Stores, General Merchandise Stores, Consumer Electronics, Home Furnishings, Homebuilding, Household Appliances, Housewares & Specialties, Leisure Products, Photographic Products, Apparel, Accessories & Luxury Goods, Footwear, Textiles, Aerospace & Defense, Building Products, Construction & Engineering, Electrical Components & Equipment, Heavy Electrical Equipment, Industrial Conglomerates, Construction & Farm Machinery & Heavy Trucks, Industrial Machinery & Equipment, Trading Companies & Distributors, Safety Equipment, Third Party Logistics (3PL), Air Freight & Logistics, Airlines, Marine Shipping, Railroads, Trucking, Airport Services, Highways & Railtracks, Marine Ports & Services, Third Party Logistics (3PL), Food Distributors, Trading Companies & Distributors, Technology Distributors, Air Freight & Logistics, Marine Shipping, Trucking, Health Care Distributors, Retail Distributors, Automobile Manufacturers, Motorcycle Manufacturers, Aerospace & Defense, Building Products, Heavy Electrical Equipment, Construction & Farm Machinery & Heavy Trucks, Industrial Machinery & Equipment, Electronic Manufacturing Services, Construction Materials, Health Care Equipment, Consumer Electronics, Computer Storage & Peripherals, Photographic Products, Apparel, Accessories & Luxury Goods, Textiles, Personal Products, Office Electronics, Auto Parts & Accessories, Paper Packaging, Health Care Supplies, Paper Products, Metal, Glass & Plastic Containers, Safety Equipment, Forest Products, Tires & Rubber, Data Processing & Outsourced Services, Advertising, Payment Processors, Environmental & Facilities Services, Office Services & Supplies, Diversified Support Services, Security & Alarm Services, Human Resource & Employment Services, Research & Consulting Services, Airport Services, Marine Ports & Services, Commercial Printing, IT Consulting & Other Services, Forest Products, Paper Products, Construction Materials, Metal, Glass & Plastic Containers, Paper Packaging, Fertilizers & Agricultural Chemicals, Industrial Gases, Specialty Chemicals, Commodity Chemicals, Diversified Chemicals, Nonmetallic Mineral Mining & Quarrying, Aluminum Products, Household Products, Personal Products, Brewers, Distillers & Vintners, Soft Drinks, Agricultural Products, Packaged Foods & Meats, Tobacco, Auto Parts & Accessories, Tires & Rubber",Gregg Delcourt,Brandon Fagerheim,Devin Timberlake,Dan Bertram,Shawn Ostrow
Sfermion,1921 Rue Grand Trunk,,Montréal,QC,H3K 1M4,CA,"Data Processing & Outsourced Services, Advertising, Payment Processors, Environmental & Facilities Services, Office Services & Supplies, Diversified Support Services, Security & Alarm Services, Human Resource & Employment Services, Research & Consulting Services, Airport Services, Marine Ports & Services, Commercial Printing, IT Consulting & Other Services",Brian Leiberman,,,,
Snowdon Partners GP Inc.,390 Notre-Dame Street West - Office 300,,Montreal,QC,H2Y 1T9,CA,"Application Software, Systems Software, Health Care Technology, Technology Distributors, Health Care Distributors, Data Processing & Outsourced Services, Advertising, Payment Processors, Environmental & Facilities Services, Office Services & Supplies, Diversified Support Services, Human Resource & Employment Services, Research & Consulting Services, Airport Services, IT Consulting & Other Services, Hotel, Resort & Cruise Line Operators, Education Services, Specialized Consumer Services, Leisure Products, Digital & Social Media, Advertising, Health Care Distributors, Health Care Services, Personal Products, Paper Packaging, Health Care Supplies, Paper Products",Liroy Haddad,Zubby Achara,Dan Chetrit,Brian Leiberman,Adam Rankine
Peloton Capital Management,8 King Street East - Suite 1100,,Toronto,ON,M5C 1B5,CA,"Mortgage Processors & Servicers, Payday Lenders, Payment Processors, Footwear, Insurance Brokers, Life & Health Insurance, Multi-line Insurance, Property & Casualty Insurance, Reinsurance, Textiles, Financial Technology, Casino & Gaming Operators, Hotel, Resort & Cruise Line Operators, Leisure Facilities, Restaurants, Education Services, Specialized Consumer Services, Auto Parts & Accessories, Tires & Rubber, Consumer Electronics, Home Furnishings, Homebuilding, Household Appliances, Housewares & Specialties, Leisure Products, Photographic Products, Health Care Equipment, Health Care Supplies, Health Care Distributors, Health Care Services, Health Care Facilities, Managed Health Care, Health Care Technology, Apparel, Accessories & Luxury Goods, Brewers, Distillers & Vintners, Soft Drinks, Agricultural Products, Packaged Foods & Meats, Tobacco, Household Products, Diversified Banks, Regional Banks, Thrifts & S&Ls, Personal Products, Other Diversified Financial Services, Multi-Sector Holdings, Specialized Finance, Asset Management & Custody Banks, Investment Banking & Brokerage, Diversified Capital Markets, Credit & Debit Card Issuers, Mortgage Banker, Mortgage Broker",Joseph Kaprielian,Sam Kogan,,,
Burlington Street Partners,150 King St W Suite 200,,Toronto,ON,M5H1J9,CA,"Third Party Logistics (3PL), Aerospace & Defense, Building Products, Construction & Engineering, Electrical Components & Equipment, Heavy Electrical Equipment, Industrial Conglomerates, Construction & Farm Machinery & Heavy Trucks, Industrial Machinery & Equipment, Trading Companies & Distributors, Safety Equipment, Data Processing & Outsourced Services, Advertising, Payment Processors, Environmental & Facilities Services, Office Services & Supplies, Diversified Support Services, Security & Alarm Services, Human Resource & Employment Services, Research & Consulting Services, Airport Services, Marine Ports & Services, Commercial Printing, IT Consulting & Other Services, Air Freight & Logistics, Airlines, Marine Shipping, Railroads, Trucking, Airport Services, Highways & Railtracks, Marine Ports & Services, Automobile Manufacturers, Motorcycle Manufacturers, Aerospace & Defense, Building Products, Heavy Electrical Equipment, Construction & Farm Machinery & Heavy Trucks, Industrial Machinery & Equipment, Electronic Manufacturing Services, Construction Materials, Health Care Equipment, Consumer Electronics, Computer Storage & Peripherals, Photographic Products, Apparel, Accessories & Luxury Goods, Textiles, Personal Products, Office Electronics, Auto Parts & Accessories, Paper Packaging, Health Care Supplies, Paper Products, Metal, Glass & Plastic Containers, Safety Equipment, Forest Products, Tires & Rubber",Justin Dudka,Pascal Ambrosino,Finley Bond,,
LaurelCrest Partners,293 King Street West,,Toronto,ON,M5V 1J5,CA,"Construction & Farm Machinery & Heavy Trucks, Industrial Machinery & Equipment, Trading Companies & Distributors, Safety Equipment, Third Party Logistics (3PL), Air Freight & Logistics, Airlines, Marine Shipping, Railroads, Trucking, Airport Services, Highways & Railtracks, Marine Ports & Services, Other Diversified Financial Services, Multi-Sector Holdings, Real Estate Operating Companies, Real Estate Development, Real Estate Services, Real Estate Investment Trusts (REITs), Third Party Logistics (3PL), Food Distributors, Trading Companies & Distributors, Technology Distributors, Air Freight & Logistics, Marine Shipping, Trucking, Health Care Distributors, Retail Distributors, Automobile Manufacturers, Motorcycle Manufacturers, Aerospace & Defense, Building Products, Heavy Electrical Equipment, Construction & Farm Machinery & Heavy Trucks, Industrial Machinery & Equipment, Electronic Manufacturing Services, Aerospace & Defense, Building Products, Construction & Engineering, Electrical Components & Equipment, Heavy Electrical Equipment, Industrial Conglomerates, Specialized Finance, Asset Management & Custody Banks, Investment Banking & Brokerage, Diversified Capital Markets, Credit & Debit Card Issuers, Mortgage Banker, Mortgage Broker, Mortgage Processors & Servicers, Payday Lenders, Payment Processors, Insurance Brokers, Life & Health Insurance, Multi-line Insurance, Property & Casualty Insurance, Reinsurance, Diversified Banks, Regional Banks, Thrifts & S&Ls, Financial Technology, Diversified Real Estate Activities, Construction Materials, Health Care Equipment, Consumer Electronics, Computer Storage & Peripherals, Photographic Products, Apparel, Accessories & Luxury Goods, Textiles, Personal Products, Office Electronics, Auto Parts & Accessories, Paper Packaging, Health Care Supplies, Paper Products, Metal, Glass & Plastic Containers, Safety Equipment, Forest Products, Tires & Rubber, Data Processing & Outsourced Services, Advertising, Payment Processors, Environmental & Facilities Services, Office Services & Supplies, Diversified Support Services, Security & Alarm Services, Human Resource & Employment Services, Research & Consulting Services, Airport Services, Marine Ports & Services, Commercial Printing, IT Consulting & Other Services, Casino & Gaming Operators, Hotel, Resort & Cruise Line Operators, Leisure Facilities, Restaurants, Education Services, Specialized Consumer Services, Apparel Retail, Computer & Electronics Retail, Home Improvement Retail, Specialty Stores, Automotive Retail, Homefurnishing Retail, Drug Retail, Food Retail, Hypermarkets & Super Centers, Retail Distributors, Catalog Retail, Internet Retail, Department Stores, General Merchandise Stores, Consumer Electronics, Home Furnishings, Homebuilding, Household Appliances, Housewares & Specialties, Leisure Products, Photographic Products, Apparel, Accessories & Luxury Goods, Footwear, Textiles, Household Products, Personal Products, Brewers, Distillers & Vintners, Soft Drinks, Agricultural Products, Packaged Foods & Meats, Tobacco, Auto Parts & Accessories, Tires & Rubber",Matthew Flynn,Eric Wong,,,
Atlasview Equity Partners,260 Queen St W,,Toronto,ON,M5V 1Z8,CA,"Electrical Components & Equipment, Computer Hardware, Computer Storage & Peripherals, Electronic Equipment & Instruments , Electronic Components, Electronic Manufacturing Services, Technology Distributors, Semiconductor Equipment , Semiconductors, Communications Equipment, Application Software, Systems Software, Home Entertainment Software, Financial Technology, Health Care Technology, Internet Software & Services",Ryan Khan,Jay Vasantharajah,April Labapis,,
Ironbridge Equity Partners,"22 Adelaide St. West, Suite 3520",,Toronto,ON,M5H 4E3,CA,"Airlines, Marine Shipping, Railroads, Airport Services, Highways & Railtracks, Marine Ports & Services, Oil & Gas Equipment & Services, Oil & Gas Storage & Transportation, Third Party Logistics (3PL), Food Distributors, Trading Companies & Distributors, Technology Distributors, Marine Shipping, Health Care Distributors, Retail Distributors, Automobile Manufacturers, Aerospace & Defense, Building Products, Heavy Electrical Equipment, Construction & Farm Machinery & Heavy Trucks, Industrial Machinery & Equipment, Electronic Manufacturing Services, Construction Materials, Health Care Equipment, Textiles, Personal Products, Auto Parts & Accessories, Paper Packaging, Health Care Supplies, Paper Products, Metal, Glass & Plastic Containers, Safety Equipment, Forest Products, Tires & Rubber, Data Processing & Outsourced Services, Advertising, Payment Processors, Environmental & Facilities Services, Office Services & Supplies, Diversified Support Services, Security & Alarm Services, Human Resource & Employment Services, Research & Consulting Services, Airport Services, Marine Ports & Services, Commercial Printing, IT Consulting & Other Services, Forest Products, Paper Products, Construction Materials, Metal, Glass & Plastic Containers, Paper Packaging, Fertilizers & Agricultural Chemicals, Industrial Gases, Specialty Chemicals, Commodity Chemicals, Diversified Chemicals, Aluminum Products, Other Metal & Mineral Products, Steel Products, Integrated Telecommunication Services, Wireless Telecommunication Services, Specialty Stores, Drug Retail, Homebuilding, Household Appliances, Housewares & Specialties, Leisure Products, Household Products, Aerospace & Defense, Building Products, Construction & Engineering, Electrical Components & Equipment, Heavy Electrical Equipment, Industrial Conglomerates, Construction & Farm Machinery & Heavy Trucks, Industrial Machinery & Equipment, Trading Companies & Distributors, Safety Equipment, Third Party Logistics (3PL), Air Freight & Logistics, Personal Products, Brewers, Distillers & Vintners, Soft Drinks, Agricultural Products, Packaged Foods & Meats, Tobacco, Auto Parts & Accessories, Tires & Rubber",Alan Sellery,Peter Samson,Ali Akbar,Andrew Walton,Jeffrey Murphy
Tandem Investment Partners,577 St Clements Ave,,Toronto,ON,M5N 1M5,CA,"Data Processing & Outsourced Services, Advertising, Payment Processors, Environmental & Facilities Services, Office Services & Supplies, Diversified Support Services, Security & Alarm Services, Human Resource & Employment Services, Research & Consulting Services, Airport Services, Marine Ports & Services, Commercial Printing, IT Consulting & Other Services, Health Care Equipment, Health Care Supplies, Health Care Distributors, Health Care Services, Health Care Facilities, Managed Health Care, Health Care Technology, Application Software, Systems Software, Home Entertainment Software, Financial Technology, Health Care Technology, Internet Software & Services, Aerospace & Defense, Building Products, Construction & Engineering, Electrical Components & Equipment, Heavy Electrical Equipment, Industrial Conglomerates, Construction & Farm Machinery & Heavy Trucks, Industrial Machinery & Equipment, Trading Companies & Distributors, Safety Equipment, Electrical Components & Equipment, Computer Hardware, Computer Storage & Peripherals, Electronic Equipment & Instruments , Electronic Components, Electronic Manufacturing Services, Technology Distributors, Semiconductor Equipment , Semiconductors, Communications Equipment, Third Party Logistics (3PL), Air Freight & Logistics, Airlines, Marine Shipping, Railroads, Trucking, Airport Services, Highways & Railtracks, Marine Ports & Services, Automobile Manufacturers, Motorcycle Manufacturers, Aerospace & Defense, Building Products, Heavy Electrical Equipment, Construction & Farm Machinery & Heavy Trucks, Industrial Machinery & Equipment, Electronic Manufacturing Services, Construction Materials, Health Care Equipment, Consumer Electronics, Computer Storage & Peripherals, Photographic Products, Apparel, Accessories & Luxury Goods, Textiles, Personal Products, Office Electronics, Auto Parts & Accessories, Paper Packaging, Health Care Supplies, Paper Products, Metal, Glass & Plastic Containers, Safety Equipment, Forest Products, Tires & Rubber",Eric Wong,,,,
"CM (Canada) Asset Management Co., Ltd.",#1200 1021 West Hastings Street,,Vancouver,BC,V6E 0C3,CA,"Marine Ports & Services, Other Diversified Financial Services, Multi-Sector Holdings, Specialized Finance, Asset Management & Custody Banks, Investment Banking & Brokerage, Diversified Capital Markets, Credit & Debit Card Issuers, Mortgage Banker, Mortgage Broker, Mortgage Processors & Servicers, Payday Lenders, Payment Processors, Insurance Brokers, Life & Health Insurance, Multi-line Insurance, Property & Casualty Insurance, Reinsurance, Diversified Banks, Aerospace & Defense, Building Products, Construction & Engineering, Electrical Components & Equipment, Heavy Electrical Equipment, Industrial Conglomerates, Construction & Farm Machinery & Heavy Trucks, Industrial Machinery & Equipment, Trading Companies & Distributors, Safety Equipment, Third Party Logistics (3PL), Air Freight & Logistics, Airlines, Marine Shipping, Railroads, Trucking, Airport Services, Highways & Railtracks, Regional Banks, Thrifts & S&Ls, Financial Technology, Diversified Real Estate Activities, Real Estate Operating Companies, Real Estate Development, Real Estate Services, Real Estate Investment Trusts (REITs), Third Party Logistics (3PL), Food Distributors, Trading Companies & Distributors, Technology Distributors, Air Freight & Logistics, Marine Shipping, Trucking, Health Care Distributors, Retail Distributors, Automobile Manufacturers, Motorcycle Manufacturers, Aerospace & Defense, Building Products, Heavy Electrical Equipment, Construction & Farm Machinery & Heavy Trucks, Industrial Machinery & Equipment, Electronic Manufacturing Services, Construction Materials, Health Care Equipment, Consumer Electronics, Computer Storage & Peripherals, Photographic Products, Apparel, Accessories & Luxury Goods, Textiles, Personal Products, Office Electronics, Auto Parts & Accessories, Paper Packaging, Health Care Supplies, Paper Products, Metal, Glass & Plastic Containers, Safety Equipment, Forest Products, Tires & Rubber, Electrical Components & Equipment, Computer Hardware, Computer Storage & Peripherals, Electronic Equipment & Instruments , Electronic Components, Electronic Manufacturing Services, Technology Distributors, Semiconductor Equipment , Semiconductors, Communications Equipment, Application Software, Systems Software, Home Entertainment Software, Financial Technology, Health Care Technology, Internet Software & Services, Data Processing & Outsourced Services, Advertising, Payment Processors, Environmental & Facilities Services, Office Services & Supplies, Diversified Support Services, Security & Alarm Services, Human Resource & Employment Services, Research & Consulting Services, Airport Services, Marine Ports & Services, Commercial Printing, IT Consulting & Other Services, Forest Products, Paper Products, Construction Materials, Metal, Glass & Plastic Containers, Paper Packaging, Fertilizers & Agricultural Chemicals, Industrial Gases, Specialty Chemicals, Commodity Chemicals, Diversified Chemicals, Nonmetallic Mineral Mining & Quarrying, Aluminum Products, Metal Ore Mining, Gold Products, Other Metal & Mineral Products, Steel Products, Casino & Gaming Operators, Hotel, Resort & Cruise Line Operators, Leisure Facilities, Restaurants, Education Services, Specialized Consumer Services, Consumer Electronics, Home Furnishings, Homebuilding, Household Appliances, Housewares & Specialties, Leisure Products, Photographic Products, Apparel, Accessories & Luxury Goods, Footwear, Textiles, Household Products, Personal Products, Brewers, Distillers & Vintners, Soft Drinks, Agricultural Products, Packaged Foods & Meats, Tobacco, Auto Parts & Accessories, Tires & Rubber",Sharon Chen,Regan Li,Kenny Zou,Lily Zuo,
Kepler Capital Corporation,"#610, 1414 8 Street SW",,Calgary,AB,T2R 1J6,CA,,Grant Daunheimer,Mathew Burpee,Edric Low,Daniel Markakos,Alexander Kinnaird
Latticework Capital,"100 Crescent Court, Suite 200",,DALLAS,TX,75201,US,"Biotechnology, Pharmaceuticals, Life Sciences Tools & Services, Nutraceuticals, Health Care Equipment, Health Care Supplies, Health Care Distributors, Health Care Services, Health Care Facilities, Managed Health Care, Health Care Technology",TJ Shepherd,Phillip Marks,Steve Neumann,Brett Lacher,
PennSpring Capital,206 B West James Street,,Lancaster ,PA,17603,US,"Financial Technology, Computer Storage & Peripherals, Technology Distributors, Application Software, Systems Software, Home Entertainment Software, Financial Technology, Health Care Technology, Internet Software & Services, Data Processing & Outsourced Services, Advertising, Payment Processors, Environmental & Facilities Services, Diversified Support Services, Security & Alarm Services, Human Resource & Employment Services, Research & Consulting Services, IT Consulting & Other Services, Digital & Social Media, Advertising, Health Care Services, Health Care Technology",Andrew Kirchner,Justin Davis,Andrew Rice,Matt Dakil,Lou Castelli
