Company Name,Street Address 1,Street Address 2,City,State,Zip Code,Country,Industries,Team Member 1,Team Member 2,Team Member 3,Team Member 4,Team Member 5
Bounds Equity Partners,"600 Central Avenue, Suite 230",,Highland Park,IL,60035,US,"Building Products, Third Party Logistics (3PL), Food Distributors, Trading Companies & Distributors, Technology Distributors, Marine Shipping, Retail Distributors, Building Products, Consumer Electronics, Computer Storage & Peripherals, Photographic Products, Apparel, Accessories & Luxury Goods, Textiles, Personal Products, Office Electronics, Auto Parts & Accessories, Paper Packaging, Paper Products, Metal, Glass & Plastic Containers, Safety Equipment, Forest Products, Tires & Rubber, Data Processing & Outsourced Services, Environmental & Facilities Services, Diversified Support Services, Human Resource & Employment Services, Construction Materials, Consumer Electronics, Home Furnishings, Homebuilding, Household Appliances, Housewares & Specialties, Leisure Products, Photographic Products, Apparel, Accessories & Luxury Goods, Household Products, Personal Products, Brewers, Agricultural Products, Packaged Foods & Meats, Auto Parts & Accessories, Tires & Rubber",Stuart Skinner,Mark Bounds,,,
ZS Fund,"630 Fifth Avenue, , Suite 1915",,New York,NY,10111,US,"Construction & Engineering, Electrical Components & Equipment, Industrial Conglomerates, Industrial Machinery & Equipment, Trading Companies & Distributors, Safety Equipment, Third Party Logistics (3PL), Trucking, Oil & Gas Equipment & Services, Payment Processors, Insurance Brokers, Real Estate Services, Third Party Logistics (3PL), Food Distributors, Trading Companies & Distributors, Technology Distributors, Trucking, Health Care Distributors, Retail Distributors, Industrial Machinery & Equipment, Apparel, Accessories & Luxury Goods, Textiles, Personal Products, Auto Parts & Accessories, Paper Packaging, Health Care Supplies, Paper Products, Metal, Glass & Plastic Containers, Safety Equipment, Technology Distributors, Data Processing & Outsourced Services, Payment Processors, Environmental & Facilities Services, Office Services & Supplies, Diversified Support Services, Security & Alarm Services, Human Resource & Employment Services, Research & Consulting Services, Marine Ports & Services, IT Consulting & Other Services, Education Services, Specialized Consumer Services, Health Care Equipment, Health Care Supplies, Health Care Distributors, Health Care Services, Health Care Technology, Apparel Retail, Specialty Stores, Retail Distributors, Internet Retail, Home Furnishings, Homebuilding, Household Appliances, Housewares & Specialties, Leisure Products, Photographic Products, Apparel, Accessories & Luxury Goods, Footwear, Textiles, Household Products, Personal Products, Agricultural Products, Packaged Foods & Meats, Auto Parts & Accessories, Nutraceuticals",Shahzad Pirvani,Dave Affinito,Aaron Smith,Adam Lehrhoff,Nick Burger
Chicago Capital Partners,"1770 First Street, Suite 200A",,Highland Park,IL,60035,US,"Industrial Conglomerates, Industrial Machinery & Equipment, Trading Companies & Distributors, Oil & Gas Equipment & Services, Life & Health Insurance, Multi-line Insurance, Property & Casualty Insurance, Reinsurance, Food Distributors, Textiles, Paper Packaging, Distillers & Vintners, Soft Drinks, Agricultural Products",Ted Rupp,Jake Low,Bill Pappas,Bill Pappas,Will Zheng
VSS Capital Partners,"400 Park Avenue, Floor 17",,New York,NY,10022,US,"Insurance Brokers, Life & Health Insurance, Multi-line Insurance, Property & Casualty Insurance, Reinsurance, Application Software, Systems Software, Financial Technology, Health Care Technology, Internet Software & Services, Construction & Engineering, Data Processing & Outsourced Services, Environmental & Facilities Services, Diversified Support Services, Human Resource & Employment Services, Research & Consulting Services, IT Consulting & Other Services, Financial Technology, Health Care Equipment, Health Care Supplies, Health Care Distributors, Health Care Services, Health Care Facilities, Managed Health Care, Health Care Technology",Carter George,Prithvi Aiyaswamy,Christopher Russell,Jeff Stevenson,William Morel
Encore Consumer Capital,"111 Pine Street, Suite 1825",,San Francisco,CA,94111,US,"Home Furnishings, Household Appliances, Housewares & Specialties, Leisure Products, Footwear, Household Products, Personal Products, Soft Drinks, Agricultural Products, Packaged Foods & Meats",Gary Smith,Scott Sellers,Bill Shen,Robert Brown,Kevin Murphy
Validor Capital,"1900 Glades Road, Suite 500",,Boca Raton,FL,33431,US,"Third Party Logistics (3PL), Food Distributors, Trading Companies & Distributors, Technology Distributors, Air Freight & Logistics, Trucking, Health Care Distributors, Retail Distributors, Marine Ports & Services, Commercial Printing, Fertilizers & Agricultural Chemicals, Industrial Gases, Specialty Chemicals, Commodity Chemicals, Diversified Chemicals, Construction Materials, Metal, Glass & Plastic Containers, Paper Packaging, Nonmetallic Mineral Mining & Quarrying, Aluminum Products, Metal Ore Mining, Gold Products, Other Metal & Mineral Products, Steel Products, Aerospace & Defense, Building Products, Construction & Engineering, Electrical Components & Equipment, Heavy Electrical Equipment, Industrial Conglomerates, Industrial Machinery & Equipment, Trading Companies & Distributors, Safety Equipment, Electrical Components & Equipment, Electronic Equipment & Instruments , Electronic Components, Electronic Manufacturing Services, Technology Distributors, Semiconductor Equipment , Semiconductors, Communications Equipment, Forest Products, Paper Products, Third Party Logistics (3PL), Air Freight & Logistics, Airlines, Marine Shipping, Railroads, Trucking, Airport Services, Marine Ports & Services, Water Utilities, Electric Utilities, Gas Utilities, Multi-Utilities, Auto Parts & Accessories, Tires & Rubber, Consumer Electronics, Home Furnishings, Homebuilding, Household Appliances, Housewares & Specialties, Photographic Products, Automobile Manufacturers, Motorcycle Manufacturers, Aerospace & Defense, Building Products, Heavy Electrical Equipment, Construction & Farm Machinery & Heavy Trucks, Industrial Machinery & Equipment, Electronic Manufacturing Services, Construction Materials, Health Care Equipment, Consumer Electronics, Computer Storage & Peripherals, Photographic Products, Apparel, Accessories & Luxury Goods, Textiles, Personal Products, Office Electronics, Auto Parts & Accessories, Paper Packaging, Health Care Supplies, Paper Products, Metal, Glass & Plastic Containers, Safety Equipment, Forest Products, Tires & Rubber, Distillers & Vintners, Agricultural Products, Packaged Foods & Meats, Household Products, Personal Products",Matt Pearson,Jared Perlman,Jeff Pieper,Matthew Kaufman,Lauren Smyers
Peterson Partners,"2755 E Cottonwood Pkwy, Suite 400",,Salt Lake City,UT,84121,US,"Consumer Electronics, Home Furnishings, Homebuilding, Household Appliances, Housewares & Specialties, Leisure Products, Photographic Products, Apparel, Accessories & Luxury Goods, Footwear, Textiles, Household Products, Personal Products, Brewers, Distillers & Vintners, Soft Drinks, Agricultural Products, Packaged Foods & Meats, Tobacco, Auto Parts & Accessories, Tires & Rubber, Electrical Components & Equipment, Computer Hardware, Computer Storage & Peripherals, Electronic Equipment & Instruments , Electronic Components, Electronic Manufacturing Services, Technology Distributors, Semiconductor Equipment , Semiconductors, Communications Equipment, Application Software, Systems Software, Home Entertainment Software, Financial Technology, Health Care Technology, Internet Software & Services, Data Processing & Outsourced Services, Advertising, Payment Processors, Environmental & Facilities Services, Office Services & Supplies, Diversified Support Services, Security & Alarm Services, Human Resource & Employment Services, Research & Consulting Services, Airport Services, Marine Ports & Services, Commercial Printing, IT Consulting & Other Services, Health Care Equipment, Health Care Supplies, Health Care Distributors, Health Care Services, Health Care Facilities, Managed Health Care, Health Care Technology, Apparel Retail, Computer & Electronics Retail, Home Improvement Retail, Specialty Stores, Automotive Retail, Homefurnishing Retail, Drug Retail, Food Retail, Hypermarkets & Super Centers, Retail Distributors, Catalog Retail, Internet Retail, Department Stores, General Merchandise Stores",Alec Snell,Chase Rigby,Kent Stepan,Travis Everton,James Carey
Compass Diversified,"301 Riverside Ave.,, Second Floor","2010 Main Street, Suite 2010",Westport,CT,6680,US,"Building Products, Electrical Components & Equipment, Industrial Machinery & Equipment, Safety Equipment, Heavy Electrical Equipment, Health Care Supplies, Consumer Electronics, Household Appliances, Housewares & Specialties, Leisure Products, Apparel, Accessories & Luxury Goods, Household Products, Personal Products, Agricultural Products",Katie Melzer,Lucas Scholhamer,Zach Sawtelle,Raj Dalal,Ryan Thorp
Sagepeak Capital,82 Washington St,,Marblehead,MA,1945,US,"Aerospace & Defense, Building Products, Diversified Banks, Education Services, Health Care Distributors, Leisure Products, Apparel, Accessories & Luxury Goods",Tyler Boes,Edward Honos,Ryan Scales,,
Arcapita Group,"1180 Peachtree Street NE, Suite 2280",,Atlanta,GA,30309,US,"Third Party Logistics (3PL), Food Distributors, Trading Companies & Distributors, Technology Distributors, Air Freight & Logistics, Marine Shipping, Trucking, Health Care Distributors, Retail Distributors, Data Processing & Outsourced Services, Advertising, Payment Processors, Environmental & Facilities Services, Office Services & Supplies, Diversified Support Services, Security & Alarm Services, Human Resource & Employment Services, Research & Consulting Services, Airport Services, Marine Ports & Services, Commercial Printing, IT Consulting & Other Services, Hotel, Resort & Cruise Line Operators, Leisure Facilities, Restaurants, Education Services, Specialized Consumer Services, Consumer Electronics, Home Furnishings, Homebuilding, Household Appliances, Housewares & Specialties, Leisure Products, Photographic Products, Apparel, Accessories & Luxury Goods, Footwear, Textiles, Household Products, Personal Products, Soft Drinks, Agricultural Products, Packaged Foods & Meats, Auto Parts & Accessories, Tires & Rubber",John Horton,Bill Hobbs,Andrea Malik Roe,Ryan Dunn,Will Bishop
Gridiron Capital,50 Pine St,,New Canaan,CT,6840,US,"Third Party Logistics (3PL), Food Distributors, Trading Companies & Distributors, Technology Distributors, Air Freight & Logistics, Marine Shipping, Trucking, Health Care Distributors, Retail Distributors, Data Processing & Outsourced Services, Advertising, Payment Processors, Environmental & Facilities Services, Office Services & Supplies, Diversified Support Services, Security & Alarm Services, Human Resource & Employment Services, Research & Consulting Services, Airport Services, Marine Ports & Services, Commercial Printing, IT Consulting & Other Services, Casino & Gaming Operators, Hotel, Resort & Cruise Line Operators, Leisure Facilities, Restaurants, Education Services, Specialized Consumer Services, Apparel Retail, Computer & Electronics Retail, Home Improvement Retail, Specialty Stores, Automotive Retail, Homefurnishing Retail, Drug Retail, Food Retail, Hypermarkets & Super Centers, Retail Distributors, Catalog Retail, Internet Retail, Department Stores, General Merchandise Stores, Application Software, Systems Software, Home Entertainment Software, Financial Technology, Health Care Technology, Internet Software & Services, Aerospace & Defense, Building Products, Construction & Engineering, Electrical Components & Equipment, Heavy Electrical Equipment, Industrial Conglomerates, Construction & Farm Machinery & Heavy Trucks, Industrial Machinery & Equipment, Trading Companies & Distributors, Safety Equipment, Electrical Components & Equipment, Computer Hardware, Computer Storage & Peripherals, Electronic Equipment & Instruments , Electronic Components, Electronic Manufacturing Services, Technology Distributors, Semiconductor Equipment , Semiconductors, Communications Equipment, Third Party Logistics (3PL), Air Freight & Logistics, Airlines, Marine Shipping, Railroads, Trucking, Airport Services, Highways & Railtracks, Marine Ports & Services, Auto Parts & Accessories, Tires & Rubber, Consumer Electronics, Home Furnishings, Homebuilding, Household Appliances, Housewares & Specialties, Leisure Products, Photographic Products, Apparel, Accessories & Luxury Goods, Footwear, Textiles, Automobile Manufacturers, Motorcycle Manufacturers, Aerospace & Defense, Building Products, Heavy Electrical Equipment, Construction & Farm Machinery & Heavy Trucks, Industrial Machinery & Equipment, Electronic Manufacturing Services, Construction Materials, Health Care Equipment, Consumer Electronics, Computer Storage & Peripherals, Photographic Products, Apparel, Accessories & Luxury Goods, Textiles, Personal Products, Office Electronics, Auto Parts & Accessories, Paper Packaging, Health Care Supplies, Paper Products, Metal, Glass & Plastic Containers, Safety Equipment, Forest Products, Tires & Rubber, Brewers, Distillers & Vintners, Soft Drinks, Agricultural Products, Packaged Foods & Meats, Household Products, Personal Products",Tim Clark,Joseph Saldutti,Will Hausberg,Gene Conese,Thomas Burger
Hammond Kennedy Whitney & Company,"8888 Keystone Crossing, Suite 600","480 Lexington Avenue, Suite 2633",Indianapolis,IN,46240,US,"Mortgage Processors & Servicers, Payment Processors, Specialty Chemicals, Metal, Glass & Plastic Containers, Paper Packaging, Application Software, Systems Software, Home Entertainment Software, Financial Technology, Health Care Technology, Internet Software & Services, Real Estate Services, Food Distributors, Technology Distributors, Safety Equipment, Electrical Components & Equipment, Computer Hardware, Health Care Distributors, Retail Distributors, Computer Storage & Peripherals, Electronic Equipment & Instruments , Electronic Components, Electronic Manufacturing Services, Data Processing & Outsourced Services, Technology Distributors, Payment Processors, Environmental & Facilities Services, Office Services & Supplies, Diversified Support Services, Security & Alarm Services, Human Resource & Employment Services, Semiconductors, Airport Services, Marine Ports & Services, Paper Products, IT Consulting & Other Services, Airport Services, Marine Ports & Services, Consumer Electronics, Education Services, Specialized Consumer Services, Wireless Telecommunication Services, Leisure Products, Financial Technology, Health Care Equipment, Health Care Supplies, Health Care Distributors, Health Care Services, Health Care Facilities, Managed Health Care, Mortgage Processors & Servicers, Payment Processors, Specialty Chemicals, Metal, Glass & Plastic Containers, Paper Packaging, Application Software, Systems Software, Home Entertainment Software, Financial Technology, Health Care Technology, Internet Software & Services, Real Estate Services, Food Distributors, Technology Distributors, Safety Equipment, Electrical Components & Equipment, Computer Hardware, Health Care Distributors, Retail Distributors, Computer Storage & Peripherals, Electronic Equipment & Instruments , Electronic Components, Electronic Manufacturing Services, Data Processing & Outsourced Services, Technology Distributors, Payment Processors, Environmental & Facilities Services, Office Services & Supplies, Diversified Support Services, Security & Alarm Services, Human Resource & Employment Services, Semiconductors, Airport Services, Marine Ports & Services, Paper Products, Health Care Technology, Consumer Electronics, Computer Storage & Peripherals, Automotive Retail, Photographic Products, Food Retail, Personal Products, Retail Distributors, Paper Packaging, Internet Retail, Health Care Supplies, Paper Products, Metal, Glass & Plastic Containers, Forest Products, Semiconductor Equipment , Biotechnology, Pharmaceuticals, Life Sciences Tools & Services, Nutraceuticals, Soft Drinks, Agricultural Products, Packaged Foods & Meats, Household Products, Communications Equipment, Personal Products, Forest Products, Other Diversified Financial Services, IT Consulting & Other Services, Airport Services, Marine Ports & Services, Consumer Electronics, Education Services, Specialized Consumer Services, Integrated Telecommunication Services, Wireless Telecommunication Services, Leisure Products, Financial Technology, Health Care Equipment, Health Care Supplies, Health Care Distributors, Health Care Services, Health Care Facilities, Managed Health Care, Health Care Technology, Consumer Electronics, Computer Storage & Peripherals, Automotive Retail, Photographic Products, Food Retail, Personal Products, Retail Distributors, Paper Packaging, Internet Retail, Health Care Supplies, Paper Products, Metal, Glass & Plastic Containers, Forest Products, Semiconductor Equipment , Biotechnology, Pharmaceuticals, Life Sciences Tools & Services, Nutraceuticals, Soft Drinks, Agricultural Products, Packaged Foods & Meats, Household Products, Communications Equipment, Personal Products, Forest Products, Other Diversified Financial Services",Michael Terrell,Aureen Sarker,Michelle Ball,Ryan Grand,Jake Luker
Council Capital,30 Burton Hills Boulevard Suite 576,,Nashville,TN,37215,US,"Health Care Services, Health Care Technology",Andrew Wilkes,Rick Apple,Paul Lagarde, ,Nick Giacco
Catalus Capital,"777 S FLAGLER DRIVE, EAST TOWER, SUITE 1005","45 East Putnam Ave, Suite 129",West Palm Beach,FL,33401,US,"Aerospace & Defense, Building Products, Construction & Engineering, Electrical Components & Equipment, Heavy Electrical Equipment, Industrial Conglomerates, Construction & Farm Machinery & Heavy Trucks, Industrial Machinery & Equipment, Trading Companies & Distributors, Safety Equipment, Third Party Logistics (3PL), Air Freight & Logistics, Airlines, Marine Shipping, Railroads, Trucking, Airport Services, Highways & Railtracks, Marine Ports & Services, Alternative Energy Production, Diversified Real Estate Activities, Real Estate Operating Companies, Real Estate Services, Technology Distributors, Air Freight & Logistics, Marine Shipping, Trucking, Automobile Manufacturers, Motorcycle Manufacturers, Aerospace & Defense, Building Products, Heavy Electrical Equipment, Construction & Farm Machinery & Heavy Trucks, Industrial Machinery & Equipment, Electronic Manufacturing Services, Construction Materials, Health Care Equipment, Consumer Electronics, Computer Storage & Peripherals, Photographic Products, Apparel, Accessories & Luxury Goods, Textiles, Personal Products, Office Electronics, Auto Parts & Accessories, Paper Packaging, Health Care Supplies, Paper Products, Metal, Glass & Plastic Containers, Safety Equipment, Forest Products, Tires & Rubber, Application Software, Systems Software, Home Entertainment Software, Financial Technology, Health Care Technology, Internet Software & Services, Payment Processors, Airport Services, Marine Ports & Services, Casino & Gaming Operators, Hotel, Resort & Cruise Line Operators, Leisure Facilities, Restaurants, Education Services, Specialized Consumer Services, Alternative Carriers, Integrated Telecommunication Services, Wireless Telecommunication Services, Cable & Satellite, Consumer Electronics, Homebuilding, Leisure Products, Footwear, Household Products, Personal Products, Brewers, Auto Parts & Accessories, Tires & Rubber",Marek Olszewski,Andrew Diaz,Saif Qazi,,
Graylight Partners,2350 W Lake of the Isles Pkwy,,Minneapolis,MN,55405,US,"Aerospace & Defense, Building Products, Construction & Engineering, Electrical Components & Equipment, Heavy Electrical Equipment, Industrial Conglomerates, Construction & Farm Machinery & Heavy Trucks, Industrial Machinery & Equipment, Trading Companies & Distributors, Safety Equipment, Third Party Logistics (3PL), Air Freight & Logistics, Airlines, Marine Shipping, Railroads, Trucking, Airport Services, Highways & Railtracks, Marine Ports & Services, Alternative Energy Production, Alternative Energy Distribution, Oil & Gas Drilling, Oil & Gas Equipment & Services, Water Utilities, Independent Power Producers & Energy Traders, Electric Utilities, Gas Utilities, Multi-Utilities, Oil & Gas Exploration & Production, Oil & Gas Refining & Marketing, Oil & Gas Storage & Transportation, Coal & Consumable Fuels, Integrated Oil & Gas, Automobile Manufacturers, Motorcycle Manufacturers, Aerospace & Defense, Building Products, Heavy Electrical Equipment, Construction & Farm Machinery & Heavy Trucks, Industrial Machinery & Equipment, Electronic Manufacturing Services, Construction Materials, Health Care Equipment, Consumer Electronics, Computer Storage & Peripherals, Photographic Products, Apparel, Accessories & Luxury Goods, Textiles, Personal Products, Office Electronics, Auto Parts & Accessories, Paper Packaging, Health Care Supplies, Paper Products, Metal, Glass & Plastic Containers, Safety Equipment, Forest Products, Tires & Rubber, Data Processing & Outsourced Services, Advertising, Payment Processors, Environmental & Facilities Services, Office Services & Supplies, Diversified Support Services, Security & Alarm Services, Human Resource & Employment Services, Research & Consulting Services, Airport Services, Marine Ports & Services, Commercial Printing, IT Consulting & Other Services, Forest Products, Paper Products, Construction Materials, Metal, Glass & Plastic Containers, Paper Packaging, Fertilizers & Agricultural Chemicals, Industrial Gases, Specialty Chemicals, Commodity Chemicals, Diversified Chemicals, Nonmetallic Mineral Mining & Quarrying, Aluminum Products, Metal Ore Mining, Gold Products, Other Metal & Mineral Products, Steel Products, Casino & Gaming Operators, Hotel, Resort & Cruise Line Operators, Leisure Facilities, Restaurants, Education Services, Specialized Consumer Services, Health Care Equipment, Health Care Supplies, Health Care Distributors, Health Care Services, Health Care Facilities, Managed Health Care, Health Care Technology, Consumer Electronics, Home Furnishings, Homebuilding, Household Appliances, Housewares & Specialties, Leisure Products, Photographic Products, Apparel, Accessories & Luxury Goods, Footwear, Textiles, Household Products, Personal Products, Brewers, Distillers & Vintners, Soft Drinks, Agricultural Products, Packaged Foods & Meats, Tobacco, Auto Parts & Accessories, Tires & Rubber",Ryan Simon,Mitchell Kern,,,
RLJ Equity Partners,"3 Bethesda Metro Center, Suite 1000",,Bethesda,MD,20814,US,"Aerospace & Defense, Building Products, Construction & Engineering, Electrical Components & Equipment, Heavy Electrical Equipment, Industrial Conglomerates, Construction & Farm Machinery & Heavy Trucks, Industrial Machinery & Equipment, Safety Equipment, Airlines, Railroads, Highways & Railtracks, Third Party Logistics (3PL), Food Distributors, Trading Companies & Distributors, Technology Distributors, Air Freight & Logistics, Marine Shipping, Trucking, Health Care Distributors, Retail Distributors, Motorcycle Manufacturers, Electronic Manufacturing Services, Computer Storage & Peripherals, Office Electronics, Paper Packaging, Health Care Supplies, Paper Products, Metal, Glass & Plastic Containers, Forest Products, Data Processing & Outsourced Services, Advertising, Payment Processors, Environmental & Facilities Services, Office Services & Supplies, Diversified Support Services, Security & Alarm Services, Human Resource & Employment Services, Research & Consulting Services, Airport Services, Marine Ports & Services, Commercial Printing, IT Consulting & Other Services, Casino & Gaming Operators, Hotel, Resort & Cruise Line Operators, Leisure Facilities, Restaurants, Education Services, Specialized Consumer Services, Integrated Telecommunication Services, Wireless Telecommunication Services, Digital & Social Media, Broadcasting, Cable & Satellite, Movies & Entertainment, Publishing, Apparel Retail, Computer & Electronics Retail, Home Improvement Retail, Specialty Stores, Automotive Retail, Homefurnishing Retail, Drug Retail, Food Retail, Hypermarkets & Super Centers, Catalog Retail, Internet Retail, Department Stores, General Merchandise Stores, Consumer Electronics, Home Furnishings, Homebuilding, Household Appliances, Housewares & Specialties, Leisure Products, Photographic Products, Apparel, Accessories & Luxury Goods, Footwear, Textiles, Household Products, Personal Products, Brewers, Distillers & Vintners, Soft Drinks, Agricultural Products, Packaged Foods & Meats, Tobacco, Auto Parts & Accessories, Tires & Rubber",Blake Weir,Otey Smith,Seth Friedman,James Moss,Rufus Rivers
MBF Healthcare Partners,121 Alhambra Plz Ste 1100,,Coral Gables,FL,33134-4522,US,"Health Care Equipment, Health Care Supplies, Health Care Distributors, Health Care Services, Health Care Facilities, Managed Health Care, Health Care Technology",Sebastian Zuluaga,Demetre Carnot,Jack Euston,Josh Weber,
